{
  "contract_sha256": "611a0455396c37d5bfd0743c3d46579d92bfe31afaa4b7deccdebce6c163daac",
  "critical_frozen_modules": [
    "doctest",
    "filecmp",
    "huggingface_hub.dataclasses",
    "jinja2.meta",
    "modulefinder",
    "timeit",
    "tqdm.contrib.logging"
  ],
  "lock_graph_sha256": "a00cdebf89e3c0160a0ee17f5eff1c46eb180daa87acca284b727e1e1c1770f2",
  "lock_source": "uv.lock",
  "managed_direct_versions": {
    "accelerate": "1.13.0",
    "diffusers": "0.39.0",
    "gguf": "0.19.0",
    "huggingface-hub": "1.8.0",
    "peft": "0.19.1",
    "sentencepiece": "0.2.1",
    "torch": "2.10.0",
    "torchvision": "0.25.0",
    "transformers": "5.3.0"
  },
  "managed_requirements": [
    "torch==2.10.0",
    "torchvision==0.25.0",
    "diffusers==0.39.0",
    "transformers==5.3.0",
    "accelerate==1.13.0",
    "peft==0.19.1",
    "sentencepiece==0.2.1",
    "gguf==0.19.0",
    "huggingface-hub==1.8.0"
  ],
  "python_minor": "3.13",
  "runtime_attributes": {
    "diffusers": [
      "DiffusionPipeline",
      "FluxPipeline",
      "Flux2KleinPipeline",
      "LTX2Pipeline",
      "LTXImageToVideoPipeline",
      "LTXPipeline",
      "QwenImagePipeline",
      "StableDiffusionPipeline",
      "StableDiffusionXLPipeline",
      "WanPipeline",
      "WanImageToVideoPipeline",
      "ZImagePipeline"
    ],
    "transformers": [
      "AutoImageProcessor",
      "AutoTokenizer"
    ]
  },
  "runtime_imports": [
    "accelerate",
    "diffusers",
    "diffusers.loaders.single_file_model",
    "diffusers.models.autoencoders.autoencoder_kl",
    "diffusers.models.autoencoders.autoencoder_kl_wan",
    "diffusers.pipelines.pipeline_utils",
    "filecmp",
    "gguf",
    "huggingface_hub.dataclasses",
    "jinja2.meta",
    "peft",
    "sentencepiece",
    "torch",
    "torchvision",
    "tqdm.contrib.logging",
    "transformers"
  ],
  "schema_version": 1,
  "shared_distributions": [
    "annotated-doc",
    "anyio",
    "certifi",
    "charset-normalizer",
    "click",
    "colorama",
    "filelock",
    "fsspec",
    "h11",
    "hf-xet",
    "httpcore",
    "httpx",
    "huggingface-hub",
    "idna",
    "importlib-metadata",
    "jinja2",
    "markdown-it-py",
    "markupsafe",
    "mdurl",
    "mpmath",
    "networkx",
    "numpy",
    "packaging",
    "pillow",
    "psutil",
    "pygments",
    "pyyaml",
    "regex",
    "requests",
    "rich",
    "setuptools",
    "shellingham",
    "sympy",
    "tokenizers",
    "tqdm",
    "typer",
    "typing-extensions",
    "urllib3",
    "zipp"
  ],
  "shared_distributions_by_target": {
    "aarch64-apple-darwin": [
      "annotated-doc",
      "anyio",
      "certifi",
      "charset-normalizer",
      "click",
      "filelock",
      "fsspec",
      "h11",
      "hf-xet",
      "httpcore",
      "httpx",
      "huggingface-hub",
      "idna",
      "importlib-metadata",
      "jinja2",
      "markdown-it-py",
      "markupsafe",
      "mdurl",
      "mpmath",
      "networkx",
      "numpy",
      "packaging",
      "pillow",
      "psutil",
      "pygments",
      "pyyaml",
      "regex",
      "requests",
      "rich",
      "setuptools",
      "shellingham",
      "sympy",
      "tokenizers",
      "tqdm",
      "typer",
      "typing-extensions",
      "urllib3",
      "zipp"
    ],
    "x86_64-apple-darwin": [
      "annotated-doc",
      "anyio",
      "certifi",
      "charset-normalizer",
      "click",
      "filelock",
      "fsspec",
      "h11",
      "hf-xet",
      "httpcore",
      "httpx",
      "huggingface-hub",
      "idna",
      "importlib-metadata",
      "jinja2",
      "markdown-it-py",
      "markupsafe",
      "mdurl",
      "mpmath",
      "networkx",
      "numpy",
      "packaging",
      "pillow",
      "psutil",
      "pygments",
      "pyyaml",
      "regex",
      "requests",
      "rich",
      "setuptools",
      "shellingham",
      "sympy",
      "tokenizers",
      "tqdm",
      "typer",
      "typing-extensions",
      "urllib3",
      "zipp"
    ],
    "x86_64-pc-windows-msvc": [
      "annotated-doc",
      "anyio",
      "certifi",
      "charset-normalizer",
      "click",
      "colorama",
      "filelock",
      "fsspec",
      "h11",
      "hf-xet",
      "httpcore",
      "httpx",
      "huggingface-hub",
      "idna",
      "importlib-metadata",
      "jinja2",
      "markdown-it-py",
      "markupsafe",
      "mdurl",
      "mpmath",
      "networkx",
      "numpy",
      "packaging",
      "pillow",
      "psutil",
      "pygments",
      "pyyaml",
      "regex",
      "requests",
      "rich",
      "setuptools",
      "shellingham",
      "sympy",
      "tokenizers",
      "tqdm",
      "typer",
      "typing-extensions",
      "urllib3",
      "zipp"
    ],
    "x86_64-unknown-linux-gnu": [
      "annotated-doc",
      "anyio",
      "certifi",
      "charset-normalizer",
      "click",
      "filelock",
      "fsspec",
      "h11",
      "hf-xet",
      "httpcore",
      "httpx",
      "huggingface-hub",
      "idna",
      "importlib-metadata",
      "jinja2",
      "markdown-it-py",
      "markupsafe",
      "mdurl",
      "mpmath",
      "networkx",
      "numpy",
      "packaging",
      "pillow",
      "psutil",
      "pygments",
      "pyyaml",
      "regex",
      "requests",
      "rich",
      "setuptools",
      "shellingham",
      "sympy",
      "tokenizers",
      "tqdm",
      "typer",
      "typing-extensions",
      "urllib3",
      "zipp"
    ]
  },
  "shared_import_packages_by_target": {
    "aarch64-apple-darwin": [
      "PIL",
      "_distutils_hack",
      "_yaml",
      "annotated_doc",
      "anyio",
      "certifi",
      "charset_normalizer",
      "click",
      "filelock",
      "fsspec",
      "h11",
      "hf_xet",
      "httpcore",
      "httpx",
      "huggingface_hub",
      "idna",
      "importlib_metadata",
      "isympy",
      "jinja2",
      "markdown_it",
      "markupsafe",
      "mdurl",
      "mpmath",
      "networkx",
      "numpy",
      "packaging",
      "psutil",
      "pygments",
      "regex",
      "requests",
      "rich",
      "setuptools",
      "shellingham",
      "sympy",
      "tokenizers",
      "tqdm",
      "typer",
      "typing_extensions",
      "urllib3",
      "yaml",
      "zipp"
    ],
    "x86_64-apple-darwin": [
      "PIL",
      "_distutils_hack",
      "_yaml",
      "annotated_doc",
      "anyio",
      "certifi",
      "charset_normalizer",
      "click",
      "filelock",
      "fsspec",
      "h11",
      "hf_xet",
      "httpcore",
      "httpx",
      "huggingface_hub",
      "idna",
      "importlib_metadata",
      "isympy",
      "jinja2",
      "markdown_it",
      "markupsafe",
      "mdurl",
      "mpmath",
      "networkx",
      "numpy",
      "packaging",
      "psutil",
      "pygments",
      "regex",
      "requests",
      "rich",
      "setuptools",
      "shellingham",
      "sympy",
      "tokenizers",
      "tqdm",
      "typer",
      "typing_extensions",
      "urllib3",
      "yaml",
      "zipp"
    ],
    "x86_64-pc-windows-msvc": [
      "PIL",
      "_distutils_hack",
      "_yaml",
      "annotated_doc",
      "anyio",
      "certifi",
      "charset_normalizer",
      "click",
      "colorama",
      "filelock",
      "fsspec",
      "h11",
      "hf_xet",
      "httpcore",
      "httpx",
      "huggingface_hub",
      "idna",
      "importlib_metadata",
      "isympy",
      "jinja2",
      "markdown_it",
      "markupsafe",
      "mdurl",
      "mpmath",
      "networkx",
      "numpy",
      "packaging",
      "psutil",
      "pygments",
      "regex",
      "requests",
      "rich",
      "setuptools",
      "shellingham",
      "sympy",
      "tokenizers",
      "tqdm",
      "typer",
      "typing_extensions",
      "urllib3",
      "yaml",
      "zipp"
    ],
    "x86_64-unknown-linux-gnu": [
      "PIL",
      "_distutils_hack",
      "_yaml",
      "annotated_doc",
      "anyio",
      "certifi",
      "charset_normalizer",
      "click",
      "filelock",
      "fsspec",
      "h11",
      "hf_xet",
      "httpcore",
      "httpx",
      "huggingface_hub",
      "idna",
      "importlib_metadata",
      "isympy",
      "jinja2",
      "markdown_it",
      "markupsafe",
      "mdurl",
      "mpmath",
      "networkx",
      "numpy",
      "packaging",
      "psutil",
      "pygments",
      "regex",
      "requests",
      "rich",
      "setuptools",
      "shellingham",
      "sympy",
      "tokenizers",
      "tqdm",
      "typer",
      "typing_extensions",
      "urllib3",
      "yaml",
      "zipp"
    ]
  },
  "shared_versions_by_target": {
    "aarch64-apple-darwin": {
      "annotated-doc": "0.0.4",
      "anyio": "4.12.1",
      "certifi": "2026.1.4",
      "charset-normalizer": "3.4.4",
      "click": "8.3.1",
      "filelock": "3.24.3",
      "fsspec": "2026.4.0",
      "h11": "0.16.0",
      "hf-xet": "1.4.2",
      "httpcore": "1.0.9",
      "httpx": "0.28.1",
      "huggingface-hub": "1.8.0",
      "idna": "3.11",
      "importlib-metadata": "8.7.1",
      "jinja2": "3.1.6",
      "markdown-it-py": "4.0.0",
      "markupsafe": "3.0.3",
      "mdurl": "0.1.2",
      "mpmath": "1.3.0",
      "networkx": "3.6.1",
      "numpy": "2.4.2",
      "packaging": "25.0",
      "pillow": "12.3.0",
      "psutil": "7.2.2",
      "pygments": "2.19.2",
      "pyyaml": "6.0.3",
      "regex": "2026.2.19",
      "requests": "2.32.5",
      "rich": "14.3.3",
      "setuptools": "82.0.0",
      "shellingham": "1.5.4",
      "sympy": "1.14.0",
      "tokenizers": "0.22.2",
      "tqdm": "4.67.3",
      "typer": "0.24.1",
      "typing-extensions": "4.15.0",
      "urllib3": "2.6.3",
      "zipp": "3.23.0"
    },
    "x86_64-apple-darwin": {
      "annotated-doc": "0.0.4",
      "anyio": "4.12.1",
      "certifi": "2026.1.4",
      "charset-normalizer": "3.4.4",
      "click": "8.3.1",
      "filelock": "3.24.3",
      "fsspec": "2026.4.0",
      "h11": "0.16.0",
      "hf-xet": "1.4.2",